<?xml version="1.0" encoding="UTF-8"?>
<!DOCTYPE mensaje SYSTEM "carta.dtd">
<mensaje>
  <remite>
    <nombre>Alfredo Reino</nombre>
    <email>alf@ibium.com</email>
  </remite>
  <destinatario>
    <nombre-d>Bill Clinton</nombre-d>
    <correo>president@whitehouse.gov</correo>
  </destinatario>
  <asunto>Hola Bill</asunto>
  <texto>
    <parrafo>¿Hola qué tal?</parrafo>
  </texto>
</mensaje>